yt_video_id,segment_index,playlist_id,conference_key,panel_title,case,kind,start_seconds,end_seconds,speaker_raw,person_key,country,affiliation,talk_title,title_autogenerated,agenda_json,chapters_json,source,upgrade_candidate,needs_review,notes,final_action,reviewer
VwtWi7zEWfk,0,PLoHwt4KyUk5DnGSoabI7MQJKrqjbe2nce,2014-england-december-2014,,5,full_session,,,"Frank Mathis performs Glinka's ""I Remember a Wondrous Moment"" Dec 7, 2014",,,,"Frank Mathis performs Glinka's ""I Remember a Wondrous Moment"" Dec 7, 2014",0,"[{""speaker_raw"":""Frank Mathis performs Glinka's \""I Remember a Wondrous Moment\"""",""person_key"":""frank-mathis-performs-glinka-s"",""affiliation"":"""",""country"":"""",""talk_title"":""I Remember a Wondrous Moment""},{""speaker_raw"":""Piano Accompaniment by Brent Bedford"",""person_key"":""piano-accompaniment-by-brent-bedford"",""affiliation"":"""",""country"":"""",""talk_title"":""""}]",,none,1,1,"ordered agenda without valid times (fewer than 2 marks)",,
gniPjCB9uHc,0,PLoHwt4KyUk5DnGSoabI7MQJKrqjbe2nce,2014-england-december-2014,,5,full_session,,,"George Hillman on why Big Pharma is cutting research on infectious disease",,,,"George Hillman on why Big Pharma is cutting research on infectious disease",0,"[{""speaker_raw"":""George Hillman, American Entrepreneur, on why the big pharmaceutical companies are not delivering on infectious disease drugs."",""person_key"":""george-hillman"",""affiliation"":"""",""country"":"""",""talk_title"":""""}]",,none,1,1,"ordered agenda without valid times (fewer than 2 marks)",,
tjOUmrE20Zk,0,PLoHwt4KyUk5DnGSoabI7MQJKrqjbe2nce,2014-england-december-2014,,4,full_session,,,"Saket Mishra from the Assocation for India’s Development",,,,"Saket Mishra from the Assocation for India’s Development",0,,,none,0,1,"no marks, no agenda",,
o3ngpiovR-8,0,PLoHwt4KyUk5DnGSoabI7MQJKrqjbe2nce,2014-england-december-2014,,4,full_session,,,"Meghan Rouillard on Vernadsky and the Noosphere",,,,"Meghan Rouillard on Vernadsky and the Noosphere",0,,,none,0,1,"no marks, no agenda",,
sDVBWWrDTd0,0,PLoHwt4KyUk5DnGSoabI7MQJKrqjbe2nce,2014-england-december-2014,,5,full_session,,,"State Rep. Andrea Boland on the Threats of EMPs. Dec 7th, 2014",,,,"State Rep. Andrea Boland on the Threats of EMPs. Dec 7th, 2014",0,"[{""speaker_raw"":""Hon. Andrea Boland, State Representative from Sandford, ME, gives a presentation on the threats of elctromagnetic pulse on the U.S. electricity grid."",""person_key"":""andrea-boland"",""affiliation"":"""",""country"":"""",""talk_title"":""""}]",,none,1,1,"ordered agenda without valid times (fewer than 2 marks)",,
7z0LqBGszao,0,PLoHwt4KyUk5DnGSoabI7MQJKrqjbe2nce,2014-england-december-2014,,4,full_session,,,"Ben Deniston on what is Mankind?  Dec 7th, 2014",,,,"Ben Deniston on what is Mankind?  Dec 7th, 2014",0,,,none,0,1,"no marks, no agenda",,
7klzIefSXQ0,0,PLoHwt4KyUk5DnGSoabI7MQJKrqjbe2nce,2014-england-december-2014,,4,full_session,,,"Question and Answer. Panel 2. Dec. 7th, 2014",,,,"Question and Answer. Panel 2. Dec. 7th, 2014",0,,,none,0,1,"no marks, no agenda",,
mTNwbzSwDi0,0,PLoHwt4KyUk5DnGSoabI7MQJKrqjbe2nce,2014-england-december-2014,,5,full_session,,,"Baifeng Sun, Confucius Institute, UMASS Boston",,,,"Baifeng Sun, Confucius Institute, UMASS Boston",0,"[{""speaker_raw"":""Baifeng Sun, Confucius Institute, UMASS Boston. On developing cultural relations between the United States and China"",""person_key"":""baifeng-sun"",""affiliation"":"""",""country"":"""",""talk_title"":""""}]",,none,1,1,"ordered agenda without valid times (fewer than 2 marks)",,
BbrsZ8at9GQ,0,PLoHwt4KyUk5DnGSoabI7MQJKrqjbe2nce,2014-england-december-2014,,4,full_session,,,"Cloret Carl Ferguson on Friedrich Schiller. Dec 7th, 2014",,,,"Cloret Carl Ferguson on Friedrich Schiller. Dec 7th, 2014",0,,,none,0,1,"no marks, no agenda",,
pJ-GkMs-9HM,0,PLoHwt4KyUk5DnGSoabI7MQJKrqjbe2nce,2014-england-december-2014,,4,full_session,,,"Excerpts from Mozart's Requiem. Dec. 7th, 2014",,,,"Excerpts from Mozart's Requiem. Dec. 7th, 2014",0,,,none,0,1,"no marks, no agenda",,
0hZiGechD2g,0,PLoHwt4KyUk5BFurDWz5mCHy8kU83q-dyN,2014-frankfurt-october-2014-30th,,4,full_session,,,"Helga Zepp-LaRouche - The New Silk Road is Transforming the Planet: A New Era of Mankind",,,,"Helga Zepp-LaRouche - The New Silk Road is Transforming the Planet: A New Era of Mankind",0,,,none,0,1,"no marks, no agenda",,
oj42VdS-iKo,0,PLoHwt4KyUk5BFurDWz5mCHy8kU83q-dyN,2014-frankfurt-october-2014-30th,,5,full_session,,,"[中文] Prof. Shi Ze - Some Innovative Ideas Concerning the Method of Cooperation along the Silk Road",,,,"[中文] Prof. Shi Ze - Some Innovative Ideas Concerning the Method of Cooperation along the Silk Road",0,"[{""speaker_raw"":""Address by Prof. Shi Ze, China Institute of International Studies, Bejing, China."",""person_key"":""address-by-prof-shi-ze"",""affiliation"":"""",""country"":"""",""talk_title"":""""}]",,none,1,1,"ordered agenda without valid times (fewer than 2 marks)",,
G37gSVRCJm0,0,PLoHwt4KyUk5BFurDWz5mCHy8kU83q-dyN,2014-frankfurt-october-2014-30th,,4,full_session,,,"Dr. Fatemeh Hashemi Rafsanjani - Iran's Role in the New Silk Road Strategy in the 3rd Millennium",,,,"Dr. Fatemeh Hashemi Rafsanjani - Iran's Role in the New Silk Road Strategy in the 3rd Millennium",0,,,none,0,1,"no marks, no agenda",,
ji7j1XLM50s,0,PLoHwt4KyUk5BFurDWz5mCHy8kU83q-dyN,2014-frankfurt-october-2014-30th,,5,full_session,,,"Jayshree Sengupta – BRICS and the New International World Order",,,,"Jayshree Sengupta – BRICS and the New International World Order",0,"[{""speaker_raw"":""Address by Jayshree Sengupta, Senior Fellow, Observer Research Foundation, New Delhi, India."",""person_key"":""address-by-jayshree-sengupta"",""affiliation"":"""",""country"":"""",""talk_title"":""""}]",,none,1,1,"ordered agenda without valid times (fewer than 2 marks)",,
OV28FmY5ycI,0,PLoHwt4KyUk5BFurDWz5mCHy8kU83q-dyN,2014-frankfurt-october-2014-30th,,4,full_session,,,"Pei Hua & Chen Bo - Greeting address from the China Soong Ching Ling Foundation",,,,"Pei Hua & Chen Bo - Greeting address from the China Soong Ching Ling Foundation",0,,,none,0,1,"no marks, no agenda",,
D-dwHjP-In8,0,PLoHwt4KyUk5BFurDWz5mCHy8kU83q-dyN,2014-frankfurt-october-2014-30th,,5,full_session,,,"Natalia Vitrenko – A Constructive Alternative to the Existing World Order",,,,"Natalia Vitrenko – A Constructive Alternative to the Existing World Order",0,"[{""speaker_raw"":""Address by Natalia Vitrenko, Economist, Chairwoman of the Progressive Socialist Party of Ukraine, Kiev, Ukraine."",""person_key"":""address-by-natalia-vitrenko"",""affiliation"":"""",""country"":"""",""talk_title"":""""}]",,none,1,1,"ordered agenda without valid times (fewer than 2 marks)",,
sEBJ3NQrx88,0,PLoHwt4KyUk5BFurDWz5mCHy8kU83q-dyN,2014-frankfurt-october-2014-30th,,5,full_session,,,"Jacques Cheminade - Europe's identity - The Advantage of the Other",,,,"Jacques Cheminade - Europe's identity - The Advantage of the Other",0,"[{""speaker_raw"":""Address by Jacques Cheminade, President of Solidarité et Progrès, Paris, France."",""person_key"":""address-by-jacques-cheminade"",""affiliation"":"""",""country"":"""",""talk_title"":""""}]",,none,1,1,"ordered agenda without valid times (fewer than 2 marks)",,
M0inLlRjAj8,0,PLoHwt4KyUk5BFurDWz5mCHy8kU83q-dyN,2014-frankfurt-october-2014-30th,,5,full_session,,,"Ray McGovern - How long will Europe dance to Washington's tune ?",,,,"Ray McGovern - How long will Europe dance to Washington's tune ?",0,"[{""speaker_raw"":""Address by Ray McGovern, Veteran Intelligence Professionals for Sanity (VIPS), USA."",""person_key"":""address-by-ray-mcgovern"",""affiliation"":"""",""country"":"""",""talk_title"":""""}]",,none,1,1,"ordered agenda without valid times (fewer than 2 marks)",,
AEO61Y8aOMc,0,PLoHwt4KyUk5BFurDWz5mCHy8kU83q-dyN,2014-frankfurt-october-2014-30th,,5,full_session,,,"Professor Enzo Siviero: Mediterranean Bridging",,,,"Professor Enzo Siviero: Mediterranean Bridging",0,"[{""speaker_raw"":""Professor Enzo Siviero, member of the Italian National Council of Universities, Venice, Italy - Mediterranean Bridging"",""person_key"":""enzo-siviero"",""affiliation"":"""",""country"":"""",""talk_title"":""""}]",,none,1,1,"ordered agenda without valid times (fewer than 2 marks)",,
dGWPt9GW1Ug,0,PLoHwt4KyUk5BFurDWz5mCHy8kU83q-dyN,2014-frankfurt-october-2014-30th,,4,full_session,,,"Jason Ross - Mining of Helium-3 on the Moon for a Fusion Power Economy and Space Propulsion",,,,"Jason Ross - Mining of Helium-3 on the Moon for a Fusion Power Economy and Space Propulsion",0,,,none,0,1,"no marks, no agenda",,
rWaWU15Qgy8,0,PLoHwt4KyUk5BFurDWz5mCHy8kU83q-dyN,2014-frankfurt-october-2014-30th,,5,full_session,,,"Ali Rastbeen – A Vision of the Future of Eurasia",,,,"Ali Rastbeen – A Vision of the Future of Eurasia",0,"[{""speaker_raw"":""Address by Ali Rastbeen, Founder and President of Paris Academy of Geopolitics, Paris, France."",""person_key"":""address-by-ali-rastbeen"",""affiliation"":"""",""country"":"""",""talk_title"":""""}]",,none,1,1,"ordered agenda without valid times (fewer than 2 marks)",,
omH7XeIcFJU,0,PLoHwt4KyUk5BFurDWz5mCHy8kU83q-dyN,2014-frankfurt-october-2014-30th,,5,full_session,,,"Col. (ret.) Alain Corvez – Common Security Interests in Eurasia",,,,"Col. (ret.) Alain Corvez – Common Security Interests in Eurasia",0,"[{""speaker_raw"":""Address by Col. (ret.) Alain Corvez, Former Advisor to the General‑in‑Command of UNIFIL, Paris, France."",""person_key"":""address-by-col-alain-corvez"",""affiliation"":"""",""country"":"""",""talk_title"":""""}]",,none,1,1,"ordered agenda without valid times (fewer than 2 marks)",,
LK_mFy7eZxs,0,PLoHwt4KyUk5BFurDWz5mCHy8kU83q-dyN,2014-frankfurt-october-2014-30th,,5,full_session,,,"Diogène Senny - BRICS and Panafricanism",,,,"Diogène Senny - BRICS and Panafricanism",0,"[{""speaker_raw"":""Address by Diogène Senny, Secretary General of the Association LP Umoja, Panafrican League, Paris, France."",""person_key"":""address-by-diogene-senny"",""affiliation"":"""",""country"":"""",""talk_title"":""""}]",,none,1,1,"ordered agenda without valid times (fewer than 2 marks)",,
K4V_kTnwjfo,0,PLoHwt4KyUk5BFurDWz5mCHy8kU83q-dyN,2014-frankfurt-october-2014-30th,,4,full_session,,,"Dr. Chandra Muzaffar (ENGLISH)",,,,"Dr. Chandra Muzaffar (ENGLISH)",0,,,none,0,1,"no marks, no agenda",,
WpXacB9ohL8,0,PLoHwt4KyUk5BFurDWz5mCHy8kU83q-dyN,2014-frankfurt-october-2014-30th,,5,full_session,,,"Antonino Galloni – Enrico Mattei’s Policy as a Universal Model for North-South, East-West Relations",,,,"Antonino Galloni – Enrico Mattei’s Policy as a Universal Model for North-South, East-West Relations",0,"[{""speaker_raw"":""Address by Antonino Galloni, Economist, Statutory Auditor of Istituto Nazionale Previdenza Sociale (INPS), Rome, Italy."",""person_key"":""address-by-antonino-galloni"",""affiliation"":"""",""country"":"""",""talk_title"":""""}]",,none,1,1,"ordered agenda without valid times (fewer than 2 marks)",,
H_hlRgeHkXU,0,PLoHwt4KyUk5BFurDWz5mCHy8kU83q-dyN,2014-frankfurt-october-2014-30th,,5,full_session,,,"Zepp-LaRouche - Resolution: ""Let us grow up into the Adult Age of Mankind!""",,,,"Zepp-LaRouche - Resolution: ""Let us grow up into the Adult Age of Mankind!""",0,"[{""speaker_raw"":""Helga Zepp-LaRouche, founder of the Schiller Institute, reads the resolution \""Let us grow up into the Adult Age of Mankind!\"" during the Schiller Institute conference."",""person_key"":""helga-zepp-larouche"",""affiliation"":"""",""country"":"""",""talk_title"":""Let us grow up into the Adult Age of Mankind!""}]",,none,1,1,"ordered agenda without valid times (fewer than 2 marks)",,
p86oZQC2O-c,0,PLoHwt4KyUk5BFurDWz5mCHy8kU83q-dyN,2014-frankfurt-october-2014-30th,,5,full_session,,,"Хельга Цепп-Ларуш: Вступительное слово - Новая эра в истории человечества",,,,"Хельга Цепп-Ларуш: Вступительное слово - Новая эра в истории человечества",0,"[{""speaker_raw"":""Хельга Цепп-Ларуш, президент Шиллеровского института"",""person_key"":""xe-a-e-apy"",""affiliation"":"""",""country"":"""",""talk_title"":""""}]",,none,1,1,"ordered agenda without valid times (fewer than 2 marks)",,
nvT_LZknS4E,0,PLoHwt4KyUk5BFurDWz5mCHy8kU83q-dyN,2014-frankfurt-october-2014-30th,,4,full_session,,,"Zepp-LaRouche - La Nouvelle Route de la Soie transforme la planète: Une nouvelle ère pour l'humanité",,,,"Zepp-LaRouche - La Nouvelle Route de la Soie transforme la planète: Une nouvelle ère pour l'humanité",0,,,none,0,1,"no marks, no agenda",,
KkdncVtMfI8,0,PLoHwt4KyUk5BFurDWz5mCHy8kU83q-dyN,2014-frankfurt-october-2014-30th,,4,full_session,,,"Helga Zepp-LaRouche - Die Neue Seidenstraße transformiert den Planeten: Eine neue Ära der Menschheit",,,,"Helga Zepp-LaRouche - Die Neue Seidenstraße transformiert den Planeten: Eine neue Ära der Menschheit",0,,,none,0,1,"no marks, no agenda",,
YZnZ-i4JO88,0,PLoHwt4KyUk5BFurDWz5mCHy8kU83q-dyN,2014-frankfurt-october-2014-30th,,5,full_session,,,"Натлья Витренко: Конструктивная альтернатива существующему миропорядку и стабильность на Украине",,,,"Натлья Витренко: Конструктивная альтернатива существующему миропорядку и стабильность на Украине",0,"[{""speaker_raw"":""Натлья Витренко, экономист, председатель Прогрессивной социалистической партии Украины, Киев"",""person_key"":""ha-b-pe-o"",""affiliation"":"""",""country"":"""",""talk_title"":""""}]",,none,1,1,"ordered agenda without valid times (fewer than 2 marks)",,
iPvcEYcJQ9A,0,PLoHwt4KyUk5BFurDWz5mCHy8kU83q-dyN,2014-frankfurt-october-2014-30th,,5,full_session,,,"Natalja Witrenko – Eine konstruktive Alternative zur gegenwärtigen Weltordnung",,,,"Natalja Witrenko – Eine konstruktive Alternative zur gegenwärtigen Weltordnung",0,"[{""speaker_raw"":""Rede von Dr. Natalja Witrenko, Wirtschaftswissenschaftlerin & Vorsitzende der Progressiven Sozialistischen Partei der Ukraine, Kiew, Ukraine."",""person_key"":""rede-von-dr-natalja-witrenko"",""affiliation"":"""",""country"":"""",""talk_title"":""""}]",,none,1,1,"ordered agenda without valid times (fewer than 2 marks)",,
JEg0Uzl7zwM,0,PLoHwt4KyUk5BFurDWz5mCHy8kU83q-dyN,2014-frankfurt-october-2014-30th,,5,full_session,,,"Natalia Vitrenko – Une alternative constructive à l'ordre mondial actuel …",,,,"Natalia Vitrenko – Une alternative constructive à l'ordre mondial actuel …",0,"[{""speaker_raw"":""Discours par Natalia Vitrenko, Économiste, Présidente du Parti Socialiste Progressiste d'Ukraine, Kiev, Ukraine."",""person_key"":""discours-par-natalia-vitrenko"",""affiliation"":"""",""country"":"""",""talk_title"":""""}]",,none,1,1,"ordered agenda without valid times (fewer than 2 marks)",,
4Ns9g1_rN78,0,PLoHwt4KyUk5BFurDWz5mCHy8kU83q-dyN,2014-frankfurt-october-2014-30th,,5,full_session,,,"Джейшри Сенгупта: БРИКС и новый международный мировой порядок",,,,"Джейшри Сенгупта: БРИКС и новый международный мировой порядок",0,"[{""speaker_raw"":""Джейшри Сенгупта, старший научный сотрудник, Аналитический исследовательский фонд, Нью-Дели, Индия"",""person_key"":""e-p-ce-y-a"",""affiliation"":"""",""country"":"""",""talk_title"":""""}]",,none,1,1,"ordered agenda without valid times (fewer than 2 marks)",,
7rNUQxbb4eA,0,PLoHwt4KyUk5BFurDWz5mCHy8kU83q-dyN,2014-frankfurt-october-2014-30th,,5,full_session,,,"Jayshree Sengupta – BRICS und die neue internationale Weltordnung",,,,"Jayshree Sengupta – BRICS und die neue internationale Weltordnung",0,"[{""speaker_raw"":""Rede von Jayshree Sengupta, Senior Fellow, Observer Research Foundation, Neu Delhi, Indien."",""person_key"":""rede-von-jayshree-sengupta"",""affiliation"":"""",""country"":"""",""talk_title"":""""}]",,none,1,1,"ordered agenda without valid times (fewer than 2 marks)",,
VP3vtHJ_gBI,0,PLoHwt4KyUk5BFurDWz5mCHy8kU83q-dyN,2014-frankfurt-october-2014-30th,,5,full_session,,,"Jayshree Sengupta – Les BRICS et le nouvel ordre international",,,,"Jayshree Sengupta – Les BRICS et le nouvel ordre international",0,"[{""speaker_raw"":""Discours par Jayshree Sengupta, Membre Honoraire, Observer Research Foundation, New Delhi, Inde."",""person_key"":""discours-par-jayshree-sengupta"",""affiliation"":"""",""country"":"""",""talk_title"":""""}]",,none,1,1,"ordered agenda without valid times (fewer than 2 marks)",,
3BsbCBKqM3M,0,PLoHwt4KyUk5BFurDWz5mCHy8kU83q-dyN,2014-frankfurt-october-2014-30th,,5,full_session,,,"Д-р Фатиме Хашеми: Роль Ирана в стратегии Нового шёлкового пути в третьем тысячелетии",,,,"Д-р Фатиме Хашеми: Роль Ирана в стратегии Нового шёлкового пути в третьем тысячелетии",0,"[{""speaker_raw"":""Д-р Фатиме Хашеми, президент Ассоциации солидарности женщин Ирана, Тегеран, Исламская республика Иран"",""person_key"":""p-a-e-xa-e"",""affiliation"":"""",""country"":"""",""talk_title"":""""}]",,none,1,1,"ordered agenda without valid times (fewer than 2 marks)",,
P5xQqzBjcXE,0,PLoHwt4KyUk5BFurDWz5mCHy8kU83q-dyN,2014-frankfurt-october-2014-30th,,4,full_session,,,"Dr. Fatemeh Hashemi Rafsanjani - Irans Rolle in der Strategie der Neuen Seidenstraße",,,,"Dr. Fatemeh Hashemi Rafsanjani - Irans Rolle in der Strategie der Neuen Seidenstraße",0,,,none,0,1,"no marks, no agenda",,
8L2r29mre8s,0,PLoHwt4KyUk5BFurDWz5mCHy8kU83q-dyN,2014-frankfurt-october-2014-30th,,4,full_session,,,"Dr Fatemeh Hashemi Rafsanjani - Le rôle de l'Iran dans la stratégie de la Nouvelle Route de la Soie",,,,"Dr Fatemeh Hashemi Rafsanjani - Le rôle de l'Iran dans la stratégie de la Nouvelle Route de la Soie",0,,,none,0,1,"no marks, no agenda",,
6Eavv_N4GdA,0,PLoHwt4KyUk5BFurDWz5mCHy8kU83q-dyN,2014-frankfurt-october-2014-30th,,4,full_session,,,"Dr. Fatemeh Hashemi Rafsanjani - Iran’s Role in the New Silk Road Strategy in the Third Millennium",,,,"Dr. Fatemeh Hashemi Rafsanjani - Iran’s Role in the New Silk Road Strategy in the Third Millennium",0,,,none,0,1,"no marks, no agenda",,
_njR--iWnFw,0,PLoHwt4KyUk5BFurDWz5mCHy8kU83q-dyN,2014-frankfurt-october-2014-30th,,5,full_session,,,"Али Растбеен: Концепция будущего Евразии",,,,"Али Растбеен: Концепция будущего Евразии",0,"[{""speaker_raw"":""Али Растбеен, основатель и президент Парижской академии геополитики, Париж, Франция"",""person_key"":""a-pac-ee"",""affiliation"":"""",""country"":"""",""talk_title"":""""}]",,none,1,1,"ordered agenda without valid times (fewer than 2 marks)",,
h5hmr2NB41Q,0,PLoHwt4KyUk5BFurDWz5mCHy8kU83q-dyN,2014-frankfurt-october-2014-30th,,5,full_session,,,"Ali Rastbeen – Eine Vision für die Zukunft Eurasiens",,,,"Ali Rastbeen – Eine Vision für die Zukunft Eurasiens",0,"[{""speaker_raw"":""Rede von Ali Rastbeen, Gründer und Präsident der Paris Academy"",""person_key"":""rede-von-ali-rastbeen"",""affiliation"":"""",""country"":"""",""talk_title"":""""}]",,none,1,1,"ordered agenda without valid times (fewer than 2 marks)",,
DlkoAVQJ52Y,0,PLoHwt4KyUk5BFurDWz5mCHy8kU83q-dyN,2014-frankfurt-october-2014-30th,,5,full_session,,,"Ali Rastbeen – Une vision pour le futur de l'Eurasie",,,,"Ali Rastbeen – Une vision pour le futur de l'Eurasie",0,"[{""speaker_raw"":""Discours par Ali Rastbeen, Fondateur et Président de l'Académie de Géopolitique de Paris, Paris, France."",""person_key"":""discours-par-ali-rastbeen"",""affiliation"":"""",""country"":"""",""talk_title"":""""}]",,none,1,1,"ordered agenda without valid times (fewer than 2 marks)",,
CjuvQ8xhjJo,0,PLoHwt4KyUk5BFurDWz5mCHy8kU83q-dyN,2014-frankfurt-october-2014-30th,,4,full_session,,,"Prof. Dr. Dieter Ameling – The Role of Steel in the New Silk Road",,,,"Prof. Dr. Dieter Ameling – The Role of Steel in the New Silk Road",0,,,none,0,1,"no marks, no agenda",,
nSXBwHQ4Yi0,0,PLoHwt4KyUk5BFurDWz5mCHy8kU83q-dyN,2014-frankfurt-october-2014-30th,,5,full_session,,,"Panos Kammenos – Greece and the New Silk Road Perspective",,,,"Panos Kammenos – Greece and the New Silk Road Perspective",0,"[{""speaker_raw"":""Address by Panos Kammenos, Chairman of the Independent Greeks, Member of Hellenic Parliament, Athens, Greece"",""person_key"":""address-by-panos-kammenos"",""affiliation"":"""",""country"":"""",""talk_title"":""""}]",,none,1,1,"ordered agenda without valid times (fewer than 2 marks)",,
IGDeRSYs00s,0,PLoHwt4KyUk5BFurDWz5mCHy8kU83q-dyN,2014-frankfurt-october-2014-30th,,4,full_session,,,"Robert Barwick – Which Way Australia? To Hell with London and Wall Street, or ...?",,,,"Robert Barwick – Which Way Australia? To Hell with London and Wall Street, or ...?",0,,,none,0,1,"no marks, no agenda",,
mJzSeaa2VRk,0,PLoHwt4KyUk5BFurDWz5mCHy8kU83q-dyN,2014-frankfurt-october-2014-30th,,5,full_session,,,"Robert Barwick – L’Australie préfère aller au paradis avec les BRICS",,,,"Robert Barwick – L’Australie préfère aller au paradis avec les BRICS",0,"[{""speaker_raw"":""Discours par Robert Barwick, Citizens Electoral Council CEC, Australie."",""person_key"":""discours-par-robert-barwick"",""affiliation"":"""",""country"":"""",""talk_title"":""""}]",,none,1,1,"ordered agenda without valid times (fewer than 2 marks)",,
9-FeKQQO3Io,0,PLoHwt4KyUk5BFurDWz5mCHy8kU83q-dyN,2014-frankfurt-october-2014-30th,,5,full_session,,,"Robert Barwick – Wohin Australien? Mit London und der Wall Street zur Hölle oder ...?",,,,"Robert Barwick – Wohin Australien? Mit London und der Wall Street zur Hölle oder ...?",0,"[{""speaker_raw"":""Rede von Robert Barwick, Citizens Electoral Council CEC, Australien."",""person_key"":""rede-von-robert-barwick"",""affiliation"":"""",""country"":"""",""talk_title"":""""}]",,none,1,1,"ordered agenda without valid times (fewer than 2 marks)",,
kZC6IlpO0JU,0,PLoHwt4KyUk5BFurDWz5mCHy8kU83q-dyN,2014-frankfurt-october-2014-30th,,5,full_session,,,"Роберт Барвик - В ад с Лондоном и Уолл-стрит или на небеса вместе с БРИКС?",,,,"Роберт Барвик - В ад с Лондоном и Уолл-стрит или на небеса вместе с БРИКС?",0,"[{""speaker_raw"":""Роберт Барвик, Совет граждан-избирателей, Австралия"",""person_key"":""po-ep-ap"",""affiliation"":"""",""country"":"""",""talk_title"":""""}]",,none,1,1,"ordered agenda without valid times (fewer than 2 marks)",,
YJd7pMp6NiA,0,PLoHwt4KyUk5BFurDWz5mCHy8kU83q-dyN,2014-frankfurt-october-2014-30th,,3,talk,,,"Jacques Cheminade - L'identité de l'Europe : l'avantage d'autrui dans le nouveau paradigme",jacques-cheminade-l-identite-de-l-europe,,,"l'avantage d'autrui dans le nouveau paradigme",0,,,per-talk-video,0,1,"single speaker, whole video",,
-Zif_2QV3kU,0,PLoHwt4KyUk5BFurDWz5mCHy8kU83q-dyN,2014-frankfurt-october-2014-30th,,5,full_session,,,"Jacques Cheminade – Europas Identität: Der Vorteil des Anderen im Neuen Paradigma",,,,"Jacques Cheminade – Europas Identität: Der Vorteil des Anderen im Neuen Paradigma",0,"[{""speaker_raw"":""Rede von Jacques Cheminade, Präsident von Solidarité et Progrès, Paris, Frankreich."",""person_key"":""rede-von-jacques-cheminade"",""affiliation"":"""",""country"":"""",""talk_title"":""""}]",,none,1,1,"ordered agenda without valid times (fewer than 2 marks)",,
kTowDECAy5g,0,PLoHwt4KyUk5BFurDWz5mCHy8kU83q-dyN,2014-frankfurt-october-2014-30th,,4,full_session,,,"Prof. Enzo Siviero – Der Brückenschlag über das Mittelmeer",,,,"Prof. Enzo Siviero – Der Brückenschlag über das Mittelmeer",0,,,none,0,1,"no marks, no agenda",,
_lxrZNo2Tsw,0,PLoHwt4KyUk5BFurDWz5mCHy8kU83q-dyN,2014-frankfurt-october-2014-30th,,5,full_session,,,"Проф. Эндзо Сивьеро - Перекрыть Средиземное море мостами",,,,"Проф. Эндзо Сивьеро - Перекрыть Средиземное море мостами",0,"[{""speaker_raw"":""Проф. Эндзо Сивьеро, член Итальянского национального совета университетов, Венеция, Италия"",""person_key"":""po-o-c-epo"",""affiliation"":"""",""country"":"""",""talk_title"":""""}]",,none,1,1,"ordered agenda without valid times (fewer than 2 marks)",,
0ETPPbYqdjs,0,PLoHwt4KyUk5BFurDWz5mCHy8kU83q-dyN,2014-frankfurt-october-2014-30th,,5,full_session,,,"Professeur Enzo Siviero – Bâtir des ponts en méditerranée",,,,"Professeur Enzo Siviero – Bâtir des ponts en méditerranée",0,"[{""speaker_raw"":""Professeur Enzo Siviero, Membre du Conseil National Italien des Universités, Venise, Italie"",""person_key"":""professeur-enzo-siviero"",""affiliation"":"""",""country"":"""",""talk_title"":""""}]",,none,1,1,"ordered agenda without valid times (fewer than 2 marks)",,
buRk0Embw9M,0,PLoHwt4KyUk5BFurDWz5mCHy8kU83q-dyN,2014-frankfurt-october-2014-30th,,4,full_session,,,"Col. Alain Corvez (cr) – Les intérêts communs de sécurité en Eurasie",,,,"Col. Alain Corvez (cr) – Les intérêts communs de sécurité en Eurasie",0,,,none,0,1,"no marks, no agenda",,
